{
  "schema_version": "simworld.vista.playable-event/v3",
  "event_id": "mmg_070",
  "compatible_house": {"house_id": "home.r1", "revision": "vista_playable_home_r1", "content_digest": "d2636c119f6b96793df494fce15b497be857c8994213a5078370a75ff443d1a7"},
  "action_catalog": {"schema_version": "vista.playable-action-catalog/v3", "catalog_id": "vista_indoor_actions", "catalog_revision": "vista_indoor_actions_r3", "content_digest": "0f761a4481586c7a684a7cddd188a6adae0ca67b8931fe3a757c6b62a79191cf"},
  "interaction_bindings": {"schema_version": "vista.playable-interaction-bindings/v1", "binding_id": "vista_home_interactions", "binding_revision": "vista_home_interactions_r1", "content_digest": "261543543ee5370f0ef784a4d44c96351d4e367447046dfd4e40192f955ea0a0"},
  "derivation": {
    "base_event_schema_version": "simworld.vista.playable-event/v1",
    "base_event_id": "mmg_070",
    "base_event_content_digest": "e4fc6ad4b42345161f4b582d4409afa077fba1cb6f2c17febb436d17184f59de",
    "source_v2_event": null,
    "change_scope": "append_digest_bound_interaction_queue"
  },
  "npc_action_queues": [
    {
      "queue_id": "op.04",
      "npc_id": "npc.resident",
      "replace": true,
      "actions": [
        {"action": "navigate_to", "room_id": "home.r1/room.bathroom_laundry"},
        {"action": "inspect", "target_id": "home.r1/room.bathroom_laundry/entity.washer.01"},
        {"action": "turn_on", "target_id": "home.r1/room.bathroom_laundry/entity.washer.01"}
      ]
    }
  ],
  "content_digest": "b04c86127bb1a58ce08ce3aefdd16210c4ea1ada87eb45407b700510050ef544"
}
