{
  "schema_version": "simworld.vista.playable-event/v3",
  "event_id": "mmg_013",
  "compatible_house": {"house_id": "home.r1", "revision": "vista_playable_home_r1", "content_digest": "d2636c119f6b96793df494fce15b497be857c8994213a5078370a75ff443d1a7"},
  "action_catalog": {"schema_version": "vista.playable-action-catalog/v3", "catalog_id": "vista_indoor_actions", "catalog_revision": "vista_indoor_actions_r3", "content_digest": "0f761a4481586c7a684a7cddd188a6adae0ca67b8931fe3a757c6b62a79191cf"},
  "interaction_bindings": {"schema_version": "vista.playable-interaction-bindings/v1", "binding_id": "vista_home_interactions", "binding_revision": "vista_home_interactions_r1", "content_digest": "261543543ee5370f0ef784a4d44c96351d4e367447046dfd4e40192f955ea0a0"},
  "derivation": {
    "base_event_schema_version": "simworld.vista.playable-event/v1",
    "base_event_id": "mmg_013",
    "base_event_content_digest": "ea9d4fd5ca4f7abb0000fe92229e1d1e45251c73811b887d09a3ad988af90b96",
    "source_v2_event": {"schema_version": "simworld.vista.playable-event/v2", "event_id": "mmg_013", "content_digest": "72ad2345257b515809ddc899d9f478b45e6f2c27a811afeda33ac6f8d1e9baa8"},
    "change_scope": "append_digest_bound_interaction_queue"
  },
  "npc_action_queues": [
    {
      "queue_id": "op.05",
      "npc_id": "npc.resident",
      "replace": true,
      "actions": [
        {"action": "navigate_to", "room_id": "home.r1/room.kitchen_dining"},
        {"action": "inspect", "target_id": "home.r1/room.kitchen_dining/entity.coffee_cup.01"},
        {"action": "pick_up", "target_id": "home.r1/room.kitchen_dining/entity.coffee_cup.01"},
        {"action": "place", "target_id": "home.r1/room.kitchen_dining/entity.dining_table.01", "placement_anchor_id": "place_setting"},
        {"action": "pick_up", "target_id": "home.r1/room.kitchen_dining/entity.coffee_cup.01"},
        {"action": "drop"},
        {"action": "navigate_to", "room_id": "home.r1/room.living_room"},
        {"action": "inspect", "target_id": "home.r1/room.living_room/entity.slipper.01"},
        {"action": "pick_up", "target_id": "home.r1/room.living_room/entity.slipper.01"},
        {"action": "drop"}
      ]
    }
  ],
  "content_digest": "81d947ee1b8dcbbf8f28a62bd061fc8bbbd5edb157dba9bf6064b9d93a906832"
}
